{
  "$ref": "#/definitions/experience",
  "definitions": {
    "experience": {
      "type": "object",
      "properties": {
        "section": {
          "type": "string",
          "enum": [
            "education",
            "professional",
            "leadership",
            "skills"
          ]
        },
        "title": {
          "type": "string"
        },
        "location": {
          "type": "string",
          "default": ""
        },
        "subtitle": {
          "type": "string",
          "default": ""
        },
        "bullets": {
          "type": "array",
          "items": {
            "type": "string"
          },
          "default": []
        },
        "order": {
          "type": "number",
          "default": 0
        },
        "$schema": {
          "type": "string"
        }
      },
      "required": [
        "section",
        "title"
      ],
      "additionalProperties": false
    }
  },
  "$schema": "http://json-schema.org/draft-07/schema#"
}