{
  "section": "leadership",
  "title": "Ole Miss Investment Group",
  "location": "Oxford, MS",
  "subtitle": "Junior Analyst — February 2026 – Present",
  "bullets": [
    "Conduct equity research on healthcare and financial services sectors, analyzing fundamentals, industry trends, and competitive positioning to identify investment opportunities",
    "Build and maintain financial models — including discounted cash flow and comparable company analysis — to support buy/sell recommendations",
    "Deliver stock pitches and investment theses to portfolio managers, defending recommendations through data-driven analysis, sector insight, and technical entry signals"
  ],
  "order": 1
}
