{
  "section": "education",
  "title": "Mississippi School for Mathematics & Science (MSMS)",
  "location": "Columbus, MS",
  "subtitle": "High School Diploma, received May 2025",
  "bullets": [
    "Mississippi's only public residential high school for academically gifted students."
  ],
  "order": 2
}
