{
  "section": "skills",
  "title": "Technical Skills",
  "location": "",
  "subtitle": "",
  "bullets": [
    "Microsoft Office, Google Workspace, Intuit QuickBooks, Adobe Creative Cloud, artificial intelligence, web development, financial modeling (DCF, Comps), legal research & writing"
  ],
  "order": 2
}
