{
  "section": "professional",
  "title": "Mississippi School for Mathematics & Science",
  "location": "Columbus, MS",
  "subtitle": "Assistant to the Director of Operations, Student IT Coordinator — August 2023 – May 2025",
  "bullets": [
    "Led the MSMS Student IT Program, personally selecting and mentoring a seven-person student team to deliver peer IT support and services campus-wide",
    "Provided full-spectrum technical support to faculty and staff: computer imaging, software installation, classroom A/V systems, inventory management, and file management",
    "Served as liaison between the IT department and school leadership, advising on technology policy, operational needs, and student-facing service improvements"
  ],
  "order": 4
}
