{
  "section": "education",
  "title": "University of Mississippi",
  "location": "Oxford, MS",
  "subtitle": "Bachelor's of Science / Bachelor's of Arts, expected May 2028",
  "bullets": [
    "B.S. in Economics",
    "B.A. in Public Policy Leadership",
    "Minor in Intelligence & Security Studies"
  ],
  "order": 1
}
