{
  "section": "leadership",
  "title": "The Daily Mississippian",
  "location": "Oxford, MS",
  "subtitle": "Opinion Writer — October 2025 – Present",
  "bullets": [
    "Author regular opinion columns for Ole Miss's student newspaper with a primary focus on economics, policy, and their political impact on Oxford and Mississippi",
    "Research and synthesize complex policy and economic topics into accessible, persuasive arguments for a general college audience",
    "Coordinate with editorial staff on publication accuracy, fact-checking, and editorial standards"
  ],
  "order": 3
}
