{
  "section": "professional",
  "title": "Cleveland Children's Clinic",
  "location": "Cleveland, MS",
  "subtitle": "IT & Operations Coordinator — January 2020 – Present",
  "bullets": [
    "Manage clinic IT infrastructure for a pediatric practice: enforce HIPAA compliance, cybersecurity protocols, software updates, and patient-facing workflow optimization",
    "Coordinate front office operations: 200+ weekly patient intakes via Athena/Phreesia, insurance verification and immunization records via MESA/MIIX, and call handling",
    "Built custom AI tools and workflow automations to cut administrative overhead; maintain financial records in QuickBooks including invoicing, expense tracking, and monthly reconciliation"
  ],
  "order": 2
}
