{
  "section": "professional",
  "title": "North Mississippi Rural Legal Services",
  "location": "Oxford, MS",
  "subtitle": "Legal Intern — January 2026 – Present",
  "bullets": [
    "Research legal issues spanning tax law, housing, family law, and public benefits for low-income clients across rural North Mississippi",
    "Assist staff attorneys with client intake and case screening, ensuring accurate documentation, issue spotting, and timely case progression",
    "Commissioned Notary Public; notarize legal documents and support attorneys with administrative tasks integral to client representation"
  ],
  "order": 1
}
