{
  "section": "professional",
  "title": "Office of the District Attorney, 16th Judicial Circuit",
  "location": "Columbus, MS",
  "subtitle": "Legal Intern — March 2025 – May 2025",
  "bullets": [
    "Organized and reviewed criminal case files, analyzed evidence, and screened cases for grand jury presentation across four-county jurisdiction",
    "Attended felony trials and preliminary hearings, traveling between Lowndes, Oktibbeha, Clay, and Noxubee counties to support prosecutors and legal staff",
    "Built professional relationships with judges, attorneys, and court staff; previously interned with the Lowndes County Justice Court Clerk's Office"
  ],
  "order": 3
}
