{
  "section": "professional",
  "title": "Bible Fellowship Cleveland",
  "location": "Cleveland, MS",
  "subtitle": "Media & Technology Coordinator — September 2020 – August 2025",
  "bullets": [
    "Managed all audio/visual infrastructure for weekly in-person services and livestreamed broadcasts, ensuring consistent high-quality output for local and remote audiences",
    "Operated, configured, and troubleshot sound systems, microphones, projectors, and recording equipment across regular services and large-scale special events",
    "Coordinated full technical production for holiday services, community programs, and special events over five years with zero-downtime delivery"
  ],
  "order": 5
}
